id,conversation_id,created_at,date,time,timezone,user_id,username,name,place,tweet,language,mentions,urls,photos,replies_count,retweets_count,likes_count,hashtags,cashtags,link,retweet,quote_url,video,thumbnail,near,geo,source,user_rt_id,user_rt,retweet_id,reply_to,retweet_date,translate,trans_src,trans_dest
1079704945866260480,1079430492192210944,2018-12-31 06:44:53 EST,2018-12-31,06:44:53,-0500,48334884,jimhigham,Jim Higham,,@atavitian And thoughts on a green replacement for dental floss?,en,[],[],[],0,0,0,[],[],https://twitter.com/JimHigham/status/1079704945866260480,False,,0,,,,,,,,"[{'screen_name': 'atavitian', 'name': 'Aram | Արամ | अरम्', 'id': '108646227'}]",,,,
1079703838670565378,1079703838670565378,2018-12-31 06:40:29 EST,2018-12-31,06:40:29,-0500,1070141037471916032,xmutli_editt,✨ 𝔼𝕣𝕚𝕟 ♡🎗,,My whole family wants me to teach them how to floss 😂 I can’t even bear the thought of the cringe. Kinda wanna die Rn 😂,en,[],[],[],0,0,0,[],[],https://twitter.com/xmutli_editt/status/1079703838670565378,False,,0,,,,,,,,[],,,,
1079703536080949249,978570955609042945,2018-12-31 06:39:17 EST,2018-12-31,06:39:17,-0500,3026501752,_casx,Desire,,@Diddss12 @Fenni_floss Fenni replying to her fan mail &amp; I was next in line,en,[],[],[],0,0,0,[],[],https://twitter.com/_Casx/status/1079703536080949249,False,,0,,,,,,,,"[{'screen_name': 'Diddss12', 'name': 'Didds', 'id': '460013953'}, {'screen_name': 'Fenni_floss', 'name': '2 HUNNA A OCCASION', 'id': '92703582'}]",,,,
1079703407026454528,1079688173045903360,2018-12-31 06:38:46 EST,2018-12-31,06:38:46,-0500,809477504905908225,sumihmichie,Sumi,,Bill tracy i have got you something from bardoas tracy and ill bring it to the shop on friday cant beluve how this year gone so quick tracy  candy floss bubble gum🍭🍭🍭🍾🍾🥂,en,[],[],[],0,1,1,[],[],https://twitter.com/sumihmichie/status/1079703407026454528,False,,0,,,,,,,,[],,,,
1079703019971928065,1079703019971928065,2018-12-31 06:37:14 EST,2018-12-31,06:37:14,-0500,746346117126823937,_daisy_hs,ليلىٰ .,,""" I slick, slick drop the top like nip slips .So he tryna smash like when the whip flips. I hit licks just to floss with this wrist """,en,[],[],[],0,0,0,[],[],https://twitter.com/_daisy_hs/status/1079703019971928065,False,,0,,,,,,,,[],,,,
1079702419624419328,978570955609042945,2018-12-31 06:34:51 EST,2018-12-31,06:34:51,-0500,3026501752,_casx,Desire,,@Diddss12 @Fenni_floss In words sis because I'm ready to fight,en,[],[],[],2,0,0,[],[],https://twitter.com/_Casx/status/1079702419624419328,False,,0,,,,,,,,"[{'screen_name': 'Diddss12', 'name': 'Didds', 'id': '460013953'}, {'screen_name': 'Fenni_floss', 'name': '2 HUNNA A OCCASION', 'id': '92703582'}]",,,,
1079701656663511045,1079701656663511045,2018-12-31 06:31:49 EST,2018-12-31,06:31:49,-0500,847718069812084737,dental_flosser,Dental Water Flosser,,How Do I Properly Floss?   https://t.co/3M8AbYDdVp,en,[],['http://rviv.ly/PyG7OS'],[],0,0,0,[],[],https://twitter.com/dental_flosser/status/1079701656663511045,False,,0,,,,,,,,[],,,,
1079700970026795008,1079700970026795008,2018-12-31 06:29:05 EST,2018-12-31,06:29:05,-0500,715028646,lawendentistry,Lawen Dentistry,,Happy New Year!  From all of us at Lawen Dentisry  Top Five New Year Resolutions... 1. Be the Boss of Floss 2. See your dentist regularly 3.Brush 2x per day for 2 full minutes 4. Kick the sugary &amp; acidic drink...  https://t.co/RpAdPnege9,en,[],['https://www.facebook.com/lawendentistry/videos/284956055703538/'],[],0,0,0,[],[],https://twitter.com/LawenDentistry/status/1079700970026795008,False,,0,,,,,,,,[],,,,
1079700729223245825,1079700729223245825,2018-12-31 06:28:08 EST,2018-12-31,06:28:08,-0500,1066191416,drragichandrika,chandrika,,Preventions of #Dental Problems. Brush your #teeth twice a day. Floss daily. Your brushing is not complete without flossing. Swish with #mouthwash. Use fluoride #toothpaste. Brush your #tongue. Visit the #dentist every six months. Visit:  https://t.co/F3slOV9BT2 Call: 7702372222  https://t.co/9xFWwoa8YG,en,[],['http://ragihospitalkukatpally.com/orthodontics.php'],['https://pbs.twimg.com/media/DvveFGLU0AUId-Q.jpg'],0,0,0,"['dental', 'teeth', 'mouthwash', 'toothpaste', 'tongue', 'dentist']",[],https://twitter.com/drragichandrika/status/1079700729223245825,False,,1,https://pbs.twimg.com/media/DvveFGLU0AUId-Q.jpg,,,,,,,[],,,,
1079700310917083138,1079700310917083138,2018-12-31 06:26:28 EST,2018-12-31,06:26:28,-0500,82130008,anthonyinglis,Anthony Inglis,,"So from Hans Zimmer and John Williams to Shostakovich, Glinka, Tchaikovsky and others and lots of fun. Stand by to floss!!!!!",en,[],[],[],1,1,8,[],[],https://twitter.com/anthonyinglis/status/1079700310917083138,False,,0,,,,,,,,[],,,,
1079700086286880768,1079700086286880768,2018-12-31 06:25:35 EST,2018-12-31,06:25:35,-0500,1079584454639869952,machzayes89,Zach Mayes,,"Can we like make a list of things we all gonna agree to leave in 2018?? ""Yeet"" that fucking floss dance, lil xan AND lil pump, Kevin Gates' blonde ass hair,mumble rap,Fergie #BirdBox But we will be taking a few things.. New Miley Cyrus, edibles, The Mullet......",en,[],[],[],1,0,0,['birdbox'],[],https://twitter.com/MachZayes89/status/1079700086286880768,False,,0,,,,,,,,[],,,,
1079699751048826881,1079699751048826881,2018-12-31 06:24:15 EST,2018-12-31,06:24:15,-0500,872981184229158912,implantspro,Implants Pro Center,,I just uploaded “1C3 OHI Floss Standard” to #Vimeo:  https://t.co/D1R11lDFWj,en,[],['https://vimeo.com/308877116'],[],0,0,2,['vimeo'],[],https://twitter.com/Implantspro/status/1079699751048826881,False,,0,,,,,,,,[],,,,
1079699711789912065,1079656344284741632,2018-12-31 06:24:05 EST,2018-12-31,06:24:05,-0500,2388661033,literallywhomma,Vic,,"@Froskurinn ""Learned to Floss"" what",en,[],[],[],0,0,0,[],[],https://twitter.com/LiterallyWhoMMA/status/1079699711789912065,False,,0,,,,,,,,"[{'screen_name': 'Froskurinn', 'name': 'Froskurinn', 'id': '1945241936'}]",,,,
1079699471754096642,1079699471754096642,2018-12-31 06:23:08 EST,2018-12-31,06:23:08,-0500,887774263893151744,secadvdental,S-bad DentalHospital,,Preventions of #Dental Problems. Brush your #teeth twice a day. Floss daily.  Skip the sugar. Swish with #mouthwash. Brush your #tongue. Visit the #dentist every six months. For More Info: Contact Us: 9866208613 Visit Us:  https://t.co/awbNJ6i2RT  https://t.co/2el72tkyn2,en,[],['http://www.secdental.com'],['https://pbs.twimg.com/media/Dvvc8LnUcAAOKAa.jpg'],0,0,0,"['dental', 'teeth', 'mouthwash', 'tongue', 'dentist']",[],https://twitter.com/secadvdental/status/1079699471754096642,False,,1,https://pbs.twimg.com/media/Dvvc8LnUcAAOKAa.jpg,,,,,,,[],,,,
1079699104433885184,1079699104433885184,2018-12-31 06:21:40 EST,2018-12-31,06:21:40,-0500,3234605938,pompyxg,PompyXG,,My New Years resolution is to hope never see another kid Floss in 2019,en,[],[],[],2,0,6,[],[],https://twitter.com/pompyxg/status/1079699104433885184,False,,0,,,,,,,,[],,,,
1079697731373821953,1079697731373821953,2018-12-31 06:16:13 EST,2018-12-31,06:16:13,-0500,3155382032,corvidcharizard,"Corvid (BLM, 1312)",,Just had a 30 year old call for a crowd of people to floss in the middle of treasury gardens  only to have my siblings join in   i fuckin knew something like this was going to happen jesus,en,[],[],[],0,0,2,[],[],https://twitter.com/CorvidCharizard/status/1079697731373821953,False,,0,,,,,,,,[],,,,
1079696878911012864,1079390573415391232,2018-12-31 06:12:50 EST,2018-12-31,06:12:50,-0500,1679161826,christmassnow94,🎃💀 C H R I S T M A S 💀🎃,,@skuffcoyote 2 per day and i always floss &lt;3 &lt;3,en,[],[],[],0,0,0,[],[],https://twitter.com/ChristmasSnow94/status/1079696878911012864,False,,0,,,,,,,,"[{'screen_name': 'skuffcoyote', 'name': 'skuffcoyote', 'id': '1337449899055407113'}]",,,,
1079696531530354690,1079696531530354690,2018-12-31 06:11:27 EST,2018-12-31,06:11:27,-0500,298078744,rst1989rob,BeingBobbyBobbyBeing,,"MY 2018 😃!  No year is all roses! Every year involves self percieved highs and lows. I don't want to pretend it's all candy floss, because it isn't (Mmm candy floss 😋😆). With this in…  https://t.co/x5thA8QrF5",en,[],['https://www.instagram.com/p/BsDK7KpgDkS/?utm_source=ig_twitter_share&igshid=1gzqzpaqilb9b'],[],0,0,0,[],[],https://twitter.com/Rst1989Rob/status/1079696531530354690,False,,0,,,,,,,,[],,,,
1079695899113259015,1079695899113259015,2018-12-31 06:08:56 EST,2018-12-31,06:08:56,-0500,296452217,karriebrewer_,Karrie ⁷ 🌱,,"well 2018 has been a year🤦🏼‍♀️I became the lamest person. Learnt how to floss, joined a dungeons &amp; dragons group (bought special dice), became the biggest kpop fan (bts stan always) You do you. Let’s get it 2019, thank u next🖤(over used phrases are my fave)  https://t.co/HFOAxLQA3h",en,[],[],['https://pbs.twimg.com/tweet_video_thumb/DvvZrwBWsAE7gKa.jpg'],1,0,5,[],[],https://twitter.com/KarrieBrewer_/status/1079695899113259015,False,,1,https://pbs.twimg.com/tweet_video_thumb/DvvZrwBWsAE7gKa.jpg,,,,,,,[],,,,
1079695690287075329,1079661951536422912,2018-12-31 06:08:06 EST,2018-12-31,06:08:06,-0500,22890554,oscarnz,David Muir,,"@DanCleary79 @mmmmaggles And I'm including the stupid fuckin idiots, who do that fucken ""Floss""  Dance.   Death to them all.",en,[],[],[],1,0,0,[],[],https://twitter.com/oscarnz/status/1079695690287075329,False,,0,,,,,,,,"[{'screen_name': 'DanCleary79', 'name': 'DanCleary', 'id': '29425265'}]",,,,
1079694776407130112,1079694776407130112,2018-12-31 06:04:29 EST,2018-12-31,06:04:29,-0500,460088725,mattmweaver54,Matt Weaver,"{'type': 'Point', 'coordinates': [52.73813479, -1.48315696]}",Jacob 💢😍🔥 teaching our auntie’s how to Floss 👌🏼🙌🏼💃🏽🕺🏽show them how it’s done son!! @ Willesley Park Golf Course  https://t.co/92ITLgb6dH,en,[],['https://www.instagram.com/p/BsDKMVOBTcB/?utm_source=ig_twitter_share&igshid=dfjovyvfun07'],[],0,0,0,[],[],https://twitter.com/MattMweaver54/status/1079694776407130112,False,,0,,,,,,,,[],,,,
1079694510752292864,1079694205948022784,2018-12-31 06:03:25 EST,2018-12-31,06:03:25,-0500,824680183386955776,otjmkfive,g.,,toothpaste/toothbrush/dental floss brand hire him before yall are sorry,en,[],[],[],0,0,0,[],[],https://twitter.com/otjmkfive/status/1079694510752292864,False,,0,,,,,,,,[],,,,
1079693479796752384,1079514527392247809,2018-12-31 05:59:19 EST,2018-12-31,05:59:19,-0500,2562119504,rengels11,Richard Engels,,"@LindseyGrahamSC @realDonaldTrump So ,how much does it cost to buy you Lindsey ?  Do you cost as much as Rand Paul,or are you in the bargain bin with Jeff Sessions ? Do you prefer payments in Rubles or do you prefer Saudi riyals ?  You smell of Russian taint,Lindsey. Maybe you should floss more. #GOPTraitors",en,[],[],[],0,0,1,['goptraitors'],[],https://twitter.com/rengels11/status/1079693479796752384,False,,0,,,,,,,,"[{'screen_name': 'LindseyGrahamSC', 'name': 'Lindsey Graham', 'id': '432895323'}, {'screen_name': 'realDonaldTrump', 'name': 'Donald J. Trump', 'id': '25073877'}]",,,,
1079692789443485696,1079692789443485696,2018-12-31 05:56:35 EST,2018-12-31,05:56:35,-0500,3307144761,limerickbard,Lime Rick,,Did you mean by The Mill On the Floss?”,en,[],[],[],0,0,0,[],[],https://twitter.com/LimerickBard/status/1079692789443485696,False,,0,,,,,,,,[],,,,
1079691901551415297,1079691901551415297,2018-12-31 05:53:03 EST,2018-12-31,05:53:03,-0500,20065936,mental_floss,Mental Floss,,Why Do Dogs Lick? —  https://t.co/ewVZEsnQ10  https://t.co/5HYZf0EEaK,en,[],['https://bit.ly/2A58Wwg'],['https://pbs.twimg.com/media/DvvWDdbXQAAstDY.jpg'],0,0,10,[],[],https://twitter.com/mental_floss/status/1079691901551415297,False,,1,https://pbs.twimg.com/media/DvvWDdbXQAAstDY.jpg,,,,,,,[],,,,
1079691746148302848,1079691746148302848,2018-12-31 05:52:26 EST,2018-12-31,05:52:26,-0500,2889263842,kpakpatoyanews,#Kpakpatoya News,,I'm a celebrity winner harry redknapp joins rita simons in panto – watch him floss  https://t.co/viyvsVv32n,en,[],['https://www.hellomagazine.com/film/2018123066037/im-a-celebrity-harry-redknapp-dances-on-stage-panto-rita-simons/'],[],0,0,0,[],[],https://twitter.com/KpakpatoyaNews/status/1079691746148302848,False,,0,,,,,,,,[],,,,
1079691440324632578,1079691440324632578,2018-12-31 05:51:13 EST,2018-12-31,05:51:13,-0500,330060657,mark0v0,Marko Vučetić,,29 years on this planet and I still don't know how much floss to pull out so I don't go back to a used section,en,[],[],[],0,0,1,[],[],https://twitter.com/mark0v0/status/1079691440324632578,False,,0,,,,,,,,[],,,,
1079690869673000960,1079690869673000960,2018-12-31 05:48:57 EST,2018-12-31,05:48:57,-0500,2838541360,georgia_clarke3,Georgia Clarke,,And to end my 2018... I CAN FLOSS🙌🏽🙌🏽🙌🏽,en,[],[],[],1,0,5,[],[],https://twitter.com/georgia_clarke3/status/1079690869673000960,False,,0,,,,,,,,[],,,,
1079689771851628546,1079688728430460928,2018-12-31 05:44:35 EST,2018-12-31,05:44:35,-0500,402184876,mbs629,Michael Ruben,,"I brush twice a day off course and floss before bed, so my oral hygiene is great!",en,[],[],[],4,0,0,[],[],https://twitter.com/mbs629/status/1079689771851628546,False,,0,,,,,,,,[],,,,
1079689635037659136,1079495888773529600,2018-12-31 05:44:03 EST,2018-12-31,05:44:03,-0500,103554348,bellacaledonia,Bella Caledonia,,@stewartbremner @meljomur @cnocanview Come to Scotland for our traditional Brattwurst and Candy Floss 😀,en,[],[],[],1,0,3,[],[],https://twitter.com/bellacaledonia/status/1079689635037659136,False,,0,,,,,,,,"[{'screen_name': 'stewartbremner', 'name': 'stewartbremner', 'id': '141057724'}, {'screen_name': 'meljomur', 'name': 'Mel 🇪🇺', 'id': '58311658'}, {'screen_name': 'cnocanview', 'name': 'Dre Henderson', 'id': '296754350'}]",,,,
1079688091001077760,1079586193564729349,2018-12-31 05:37:55 EST,2018-12-31,05:37:55,-0500,778514070945300480,sft_o,Ace-Hole Rimmer,,@mental_floss Does nobody proof read these articles for basic spelling and grammar errors?,en,[],[],[],0,0,0,[],[],https://twitter.com/sft_o/status/1079688091001077760,False,,0,,,,,,,,"[{'screen_name': 'mental_floss', 'name': 'Mental Floss', 'id': '20065936'}]",,,,
1079688029957173248,1079688029957173248,2018-12-31 05:37:40 EST,2018-12-31,05:37:40,-0500,987063522398998528,swappingroses,Read My Pinned,,The Backpack kid who did the floss really annoys me.,en,[],[],[],0,0,0,[],[],https://twitter.com/SwappingRoses/status/1079688029957173248,False,,0,,,,,,,,[],,,,
1079687813271044096,1079687338333224960,2018-12-31 05:36:48 EST,2018-12-31,05:36:48,-0500,3512474615,t_olusina,Tolulope,,"I go in to look for socks, I come out with slides and dental floss Another day I go in for the same socks, I come out with handcream and a purse.   I should stop looking for these socks",en,[],[],[],3,0,0,[],[],https://twitter.com/t_olusina/status/1079687813271044096,False,,0,,,,,,,,[],,,,
1079686147801001985,1079686147801001985,2018-12-31 05:30:11 EST,2018-12-31,05:30:11,-0500,156938883,ilwiwdotcom,I Like What I Write,,Poetry: Did You Know The Inside of Your Mind Looks Like Candy Floss by Gugu Kweli Kheswa  https://t.co/DCAATLqgwH,en,[],['http://ilikewhatiwrite.co.za/2018/11/27/did-you-know-the-inside-of-your-mind-looks-like-candy-floss/'],[],0,1,0,[],[],https://twitter.com/ILWIWDotCom/status/1079686147801001985,False,,0,,,,,,,,[],,,,
1079685529371795461,1079685529371795461,2018-12-31 05:27:44 EST,2018-12-31,05:27:44,-0500,2205641946,httpdreaa,🧚,,That floss b2b 4B set was not the business,en,[],[],[],0,0,0,[],[],https://twitter.com/httpdreaa/status/1079685529371795461,False,,0,,,,,,,,[],,,,
1079684722911993856,1078967693884211200,2018-12-31 05:24:32 EST,2018-12-31,05:24:32,-0500,20481697,paulsinha,Paul Sinha,,"@Steverc99 @douglaschats @5liveSport @BBCfightingtalk @bbc5live @Minarzouki @ColinMurray @BBCSounds I spent the first two seconds trying to remember which Spurs player does the ""floss dance"" and by the time i realised that I couldnt remember, all DTI momentum was gone",en,[],[],[],0,0,2,[],[],https://twitter.com/paulsinha/status/1079684722911993856,False,,0,,,,,,,,"[{'screen_name': 'Steverc99', 'name': '(((Steve C)))', 'id': '77063130'}, {'screen_name': 'douglaschats', 'name': 'Douglas Anderson', 'id': '102707566'}, {'screen_name': '5liveSport', 'name': 'BBC 5 Live Sport', 'id': '425989199'}, {'screen_name': 'bbc5live', 'name': 'BBC Radio 5 Live', 'id': '7589572'}, {'screen_name': 'Minarzouki', 'name': 'Mina Rzouki', 'id': '106288078'}, {'screen_name': 'ColinMurray', 'name': 'colin murray', 'id': '1384636117'}, {'screen_name': 'BBCSounds', 'name': 'BBC Sounds', 'id': '20518298'}]",,,,
1079684514555850752,1079684514555850752,2018-12-31 05:23:42 EST,2018-12-31,05:23:42,-0500,27077638,jennifermoira_x,Jen 🌿,,Whatever happened to candy floss grapes? Those things were heaven in a plastic box but it's like they dropped off the face of the earth.,en,[],[],[],0,0,2,[],[],https://twitter.com/jennifermoira_x/status/1079684514555850752,False,,0,,,,,,,,[],,,,
1079683863482228736,1079676790514352128,2018-12-31 05:21:07 EST,2018-12-31,05:21:07,-0500,17516488,beantari,It’s time,,@mental_floss Our issue is forks,en,[],[],[],0,0,0,[],[],https://twitter.com/Beantari/status/1079683863482228736,False,,0,,,,,,,,"[{'screen_name': 'mental_floss', 'name': 'Mental Floss', 'id': '20065936'}]",,,,
1079683323037925376,1079544397656719361,2018-12-31 05:18:58 EST,2018-12-31,05:18:58,-0500,1035896999919398912,amy_clue,Snarf,,@leeleeb50 Candy floss seller,en,[],[],[],0,0,0,[],[],https://twitter.com/amy_clue/status/1079683323037925376,False,,0,,,,,,,,"[{'screen_name': 'leeleeb50', 'name': 'leeleeb50VoteBlueNoMatterWho🌊🌊🌊', 'id': '16190397'}]",,,,
1079682501751291904,1079656344284741632,2018-12-31 05:15:42 EST,2018-12-31,05:15:42,-0500,899411192996929537,fearioh_,Call me Aspi,,"@Froskurinn ""Learned to Floss"" you had me at hello",en,[],[],[],0,0,0,[],[],https://twitter.com/Fearioh_/status/1079682501751291904,False,,0,,,,,,,,"[{'screen_name': 'Froskurinn', 'name': 'Froskurinn', 'id': '1945241936'}]",,,,
1079682406146285568,1079682406146285568,2018-12-31 05:15:19 EST,2018-12-31,05:15:19,-0500,3251233128,jayno9_,x,,that yb who do the corny ass floss dance got his ass kicked off the stage 😭😭😭,en,[],[],[],0,0,0,[],[],https://twitter.com/jayno9_/status/1079682406146285568,False,,0,,,,,,,,[],,,,
1079681238410117120,1079681238410117120,2018-12-31 05:10:41 EST,2018-12-31,05:10:41,-0500,16018026,thedoriangrae,DORIANGRÆ λ,,Epic might skate ob Floss or The Carlton dance but that Napoleon Dynamite one is open and shut ripping off,en,[],[],[],0,0,0,[],[],https://twitter.com/TheDORIANGRAE/status/1079681238410117120,False,,0,,,,,,,,[],,,,
1079680895534149632,978570955609042945,2018-12-31 05:09:19 EST,2018-12-31,05:09:19,-0500,3026501752,_casx,Desire,,@Fenni_floss @Diddss12 who does Fenni think she is?,en,[],[],[],1,0,1,[],[],https://twitter.com/_Casx/status/1079680895534149632,False,,0,,,,,,,,"[{'screen_name': 'Fenni_floss', 'name': '2 HUNNA A OCCASION', 'id': '92703582'}]",,,,
1079680826227519488,1079269896637173760,2018-12-31 05:09:03 EST,2018-12-31,05:09:03,-0500,1003157413145534464,neffabledestiel,A Dark and Stormy Knight,,"@USA_vs_UK ... I know for a fact in England cotton candy is called candy floss, just for one thing. What’re you on?",en,[],[],[],0,0,0,[],[],https://twitter.com/neffabledestiel/status/1079680826227519488,False,,0,,,,,,,,"[{'screen_name': 'USA_vs_UK', 'name': 'American Vs British', 'id': '3425881216'}]",,,,
1079679869133279232,1079502512644751360,2018-12-31 05:05:14 EST,2018-12-31,05:05:14,-0500,891555414143156224,hjabwrites,Hayley Baxter,,@ryanjwpope Yep. Sticking with floss more over here but I wish you both the best in your respective missions,en,[],[],[],0,0,1,[],[],https://twitter.com/HJABWrites/status/1079679869133279232,False,,0,,,,,,,,[],,,,
1079679860551835648,1079679860551835648,2018-12-31 05:05:12 EST,2018-12-31,05:05:12,-0500,741693872900866049,ovwmercy,mercy,,How often do you floss?,en,[],[],[],0,0,0,[],[],https://twitter.com/ovwmercy/status/1079679860551835648,False,,0,,,,,,,,[],,,,
1079677774657474565,1079677774657474565,2018-12-31 04:56:55 EST,2018-12-31,04:56:55,-0500,1033230415,localfmradio,LocalFM,,Now playing Floss With Steve (Live From The Vatican 1975) by Unikord!,en,[],[],[],0,0,0,[],[],https://twitter.com/LocalFMRadio/status/1079677774657474565,False,,0,,,,,,,,[],,,,
1079676971464908801,1079671568752615424,2018-12-31 04:53:44 EST,2018-12-31,04:53:44,-0500,759622558693990400,harrissocal,"Thomas C Harris, just plain Tom.",,"@JoeOfTheNorth @cmclymer Thanks, Joe. I didn't open it earlier when Charlotte Rt'ed it, and now I need mental floss. Happy New Year to both of you anyway! LOL💯🦇💩🤪",en,[],[],[],1,0,0,[],[],https://twitter.com/harrissocal/status/1079676971464908801,False,,0,,,,,,,,"[{'screen_name': 'JoeOfTheNorth', 'name': 'Joe Remi', 'id': '47296192'}, {'screen_name': 'cmclymer', 'name': 'Charlotte Clymer 🏳️\u200d🌈', 'id': '15907183'}]",,,,
1079676790514352128,1079676790514352128,2018-12-31 04:53:00 EST,2018-12-31,04:53:00,-0500,20065936,mental_floss,Mental Floss,,The Time Australian Researchers Studied Why There Are Never Any Spoons in Your Office Kitchen —  https://t.co/dYroYwSoEu  https://t.co/R0L0WaKS9O,en,[],['https://bit.ly/2RfxNbi'],['https://pbs.twimg.com/media/DvvIUZtXcAA2ZwE.jpg'],1,2,6,[],[],https://twitter.com/mental_floss/status/1079676790514352128,False,,1,https://pbs.twimg.com/media/DvvIUZtXcAA2ZwE.jpg,,,,,,,[],,,,
1079676347599998976,1079676347599998976,2018-12-31 04:51:15 EST,2018-12-31,04:51:15,-0500,736228792524496896,astrolaurad,Laura,,"Sorry Northern Hemisphere, but blue sky and fairy floss at the MCG is how #NewYearsEve should be!!!  I hope 2019 is good to you all!!! 😘 #HappyNewYear  https://t.co/lVyIaqulAJ",en,[],[],['https://pbs.twimg.com/media/DvvH5i2W0AEWQNK.jpg'],0,1,7,"['newyearseve', 'happynewyear']",[],https://twitter.com/AstroLauraD/status/1079676347599998976,False,,1,https://pbs.twimg.com/media/DvvH5i2W0AEWQNK.jpg,,,,,,,[],,,,
1079675747122507778,1079675747122507778,2018-12-31 04:48:52 EST,2018-12-31,04:48:52,-0500,746421702389800960,_quinnt_,quinty.😜✌,,Ive been doing the floss dance in awkward situations recently. Ew🙊😂,en,[],[],[],0,0,0,[],[],https://twitter.com/_QUINNT_/status/1079675747122507778,False,,0,,,,,,,,[],,,,
1079675574363348992,1079675574363348992,2018-12-31 04:48:10 EST,2018-12-31,04:48:10,-0500,25820074,lou_bear1,Lou Bear,,65 yr old Dad just referenced “the floss dance” when asked how he even knew what that was it’s because “@JesseLingard has been doing it for the last season and a half”,en,"[{'screen_name': 'jesselingard', 'name': 'jesse lingard', 'id': '755703497195225088'}]",[],[],0,0,0,[],[],https://twitter.com/lou_bear1/status/1079675574363348992,False,,0,,,,,,,,[],,,,
1079673826395475968,1079673826395475968,2018-12-31 04:41:14 EST,2018-12-31,04:41:14,-0500,882170497441640449,jb9782,Giving m3 Lif3 😎,,@MaureenUmehFox5 plz don't floss again 😂😂😂😂,en,[],[],[],0,0,0,[],[],https://twitter.com/Jb9782/status/1079673826395475968,False,,0,,,,,,,,[],,,,
1079673313146925061,1079673313146925061,2018-12-31 04:39:11 EST,2018-12-31,04:39:11,-0500,863749244993372160,doteverest,artiebot,,don't forget to floss your teeth,en,[],[],[],0,0,0,[],[],https://twitter.com/doteverest/status/1079673313146925061,False,,0,,,,,,,,[],,,,
1079671047060946945,1079671047060946945,2018-12-31 04:30:11 EST,2018-12-31,04:30:11,-0500,886980500677677056,churrosknot,TheKnotChurros,,The Knot Churros Grand Opening This Friday the 4th Jan from 4pm-8pm You are all invited for a free candy floss hot drink! FUN FACT - All our churros are vegan friendly and baked! Yes desserts can be healthy!   #dessert #food #sweettooth #yummy #instafood #chocolate  https://t.co/fepn1MoFsl,en,[],[],['https://pbs.twimg.com/media/Dvu-WMLXcAAfEHP.jpg'],0,0,0,"['dessert', 'food', 'sweettooth', 'yummy', 'instafood', 'chocolate']",[],https://twitter.com/ChurrosKnot/status/1079671047060946945,False,,1,https://pbs.twimg.com/media/Dvu-WMLXcAAfEHP.jpg,,,,,,,[],,,,
1079670188344193024,1079670188344193024,2018-12-31 04:26:46 EST,2018-12-31,04:26:46,-0500,2288608243,tajhoopz,タージ 〽️🚆,,Let’s not forget to floss every night my People,en,[],[],[],0,1,2,[],[],https://twitter.com/TajHoopz/status/1079670188344193024,False,,0,,,,,,,,[],,,,
1079670064834580480,1079513423711555584,2018-12-31 04:26:17 EST,2018-12-31,04:26:17,-0500,2562287993,meth_eireann,Tinchy Stryder update account,,@JoeArundelMc @callummarkie Me when I floss,en,[],[],[],0,0,1,[],[],https://twitter.com/meth_eireann/status/1079670064834580480,False,,0,,,,,,,,"[{'screen_name': 'JoeArundelMc', 'name': 'Joe Arundel McSweeney', 'id': '2834497833'}, {'screen_name': 'callummarkie', 'name': 'Callum Markie', 'id': '3572908275'}]",,,,
1079668437306097664,1079668437306097664,2018-12-31 04:19:49 EST,2018-12-31,04:19:49,-0500,2345574312,itsmsrandom,eXistential chOla (she/her),,I wonder how many rappers that rap about flossin’ actually floss.  *things I think about as I floss* #stonerthoughts,en,[],[],[],0,0,0,['stonerthoughts'],[],https://twitter.com/ItsMsRandom/status/1079668437306097664,False,,0,,,,,,,,[],,,,
1079667175617675264,1079667175617675264,2018-12-31 04:14:48 EST,2018-12-31,04:14:48,-0500,27446001,gameymctwat,General Shitemeister,,"Well, I'll sure be completely, absolutely, irreparably distraught to see the end of the Year of the Floss... Can all children (and extremely upsettingly some adults) stop now... JUST STOP!!!!  https://t.co/I4zvkEgUIP",en,[],[],['https://pbs.twimg.com/tweet_video_thumb/Dvu_kTPWkAEDV6y.jpg'],2,0,2,[],[],https://twitter.com/GameyMcTwat/status/1079667175617675264,False,,1,https://pbs.twimg.com/tweet_video_thumb/Dvu_kTPWkAEDV6y.jpg,,,,,,,[],,,,
