id,conversation_id,created_at,date,time,timezone,user_id,username,name,place,tweet,language,mentions,urls,photos,replies_count,retweets_count,likes_count,hashtags,cashtags,link,retweet,quote_url,video,thumbnail,near,geo,source,user_rt_id,user_rt,retweet_id,reply_to,retweet_date,translate,trans_src,trans_dest
1079889765393199111,1079889765393199111,2018-12-31 18:59:18 EST,2018-12-31,18:59:18,-0500,613848065,christaharris_,christa she/her,,HAPPY NEW YEAR ERRYBADY! Spent my last 5 mins of 2018 trying to teach my family how to floss. Have a cracking one! 💫✨🎆🍾,en,[],[],[],0,0,3,[],[],https://twitter.com/christaharris_/status/1079889765393199111,False,,0,,,,,,,,[],,,,
1079889235493163010,1079867579873644544,2018-12-31 18:57:11 EST,2018-12-31,18:57:11,-0500,569534236,jimmyihle,james,,@landonromano Dental floss,en,[],[],[],0,0,0,[],[],https://twitter.com/jimmyihle/status/1079889235493163010,False,,0,,,,,,,,"[{'screen_name': 'landonromano', 'name': 'Landon Romano', 'id': '45773023'}]",,,,
1079889210700632064,1079889210700632064,2018-12-31 18:57:05 EST,2018-12-31,18:57:05,-0500,462076892,shanice_om,Shanice 😈,,4 mins to the new year. My New Years resolution is learn how to floss.,en,[],[],[],0,0,1,[],[],https://twitter.com/Shanice_OM/status/1079889210700632064,False,,0,,,,,,,,[],,,,
1079888933297799169,1079888933297799169,2018-12-31 18:55:59 EST,2018-12-31,18:55:59,-0500,783207560,ianharrison09,Ian Harrison,,Lets leave the floss dance in 2018 aswell then yeah? Ok? Sound.,en,[],[],[],3,0,6,[],[],https://twitter.com/ianharrison09/status/1079888933297799169,False,,0,,,,,,,,[],,,,
1079888749654355968,1079888749654355968,2018-12-31 18:55:15 EST,2018-12-31,18:55:15,-0500,711567281214660609,sophh,Sophia 🦋,,As if they’re doing the floss on TV😂,en,[],[],[],1,0,7,[],[],https://twitter.com/Sophh/status/1079888749654355968,False,,0,,,,,,,,[],,,,
1079888743358783488,1079888743358783488,2018-12-31 18:55:14 EST,2018-12-31,18:55:14,-0500,124025809,scarletwestend,Scarlet West,,The Floss? Have I missed something?,en,[],[],[],0,0,0,[],[],https://twitter.com/scarletwestend/status/1079888743358783488,False,,0,,,,,,,,[],,,,
1079888705140215809,1079888705140215809,2018-12-31 18:55:05 EST,2018-12-31,18:55:05,-0500,90253055,debruning,David Bruning,,"California Pet Stores Can No Longer Use 'Puppy Mills,' According to a New Law - Mental Floss -  https://t.co/Qq0ohXvDeV",en,[],['http://www.bruning.com/news/2018/12/california-pet-stores-can-no-longer-use-puppy-mills-according-to-a-new-law-mental-floss/'],[],0,0,0,[],[],https://twitter.com/debruning/status/1079888705140215809,False,,0,,,,,,,,[],,,,
1079888559597912064,1079887172373762053,2018-12-31 18:54:30 EST,2018-12-31,18:54:30,-0500,138741461,adamdnathan,Adam Nathan,,@Billie_T Too many homophobic warlords to shake hands with to have time to learn how to floss,en,[],[],[],1,1,34,[],[],https://twitter.com/adamdnathan/status/1079888559597912064,False,,0,,,,,,,,"[{'screen_name': 'Billie_T', 'name': 'Billie', 'id': '153806777'}]",,,,
1079888262305587200,1079888262305587200,2018-12-31 18:53:19 EST,2018-12-31,18:53:19,-0500,3357189976,mjayne_21,Megan Jayne Shepherd🌿,,Just had a hilarious incident of witnessing my mum trying to do the floss dance 🤣 we both ended up crying with laughter! I ended up having to Google videos on how to do it properly which only made us laugh more 😂   Wishing everyone a happy New Year! 🎉💗,en,[],[],[],0,0,8,[],[],https://twitter.com/MJayne_21/status/1079888262305587200,False,,0,,,,,,,,[],,,,
1079888184090202112,1079888184090202112,2018-12-31 18:53:01 EST,2018-12-31,18:53:01,-0500,20065936,mental_floss,Mental Floss,,Here's the Perfect Temperature at Which You Should Drink Champagne —  https://t.co/zFy85MYv6Z  https://t.co/u4e2xncEyu,en,[],['https://bit.ly/2Swo7Xk'],['https://pbs.twimg.com/media/DvyIlFXWwAIDLOG.jpg'],1,1,6,[],[],https://twitter.com/mental_floss/status/1079888184090202112,False,,1,https://pbs.twimg.com/media/DvyIlFXWwAIDLOG.jpg,,,,,,,[],,,,
1079888155170328576,1079888155170328576,2018-12-31 18:52:54 EST,2018-12-31,18:52:54,-0500,581757372,isaac21williams,Isaac Williams,,My new years resolution is to floss my teeth every couple of days,en,[],[],[],0,0,0,[],[],https://twitter.com/isaac21williams/status/1079888155170328576,False,,0,,,,,,,,[],,,,
1079887651904339968,1079887651904339968,2018-12-31 18:50:54 EST,2018-12-31,18:50:54,-0500,598685897,captaincapybara,xX⚓️🌮🦝🇳🇿Xx,,If you still can't do the floss then you slackin' son,en,[],[],[],0,0,4,[],[],https://twitter.com/captaincapybara/status/1079887651904339968,False,,0,,,,,,,,[],,,,
1079886944178446337,1079886944178446337,2018-12-31 18:48:05 EST,2018-12-31,18:48:05,-0500,523227189,fftcouk,Fly Fishing Tackle,,"#flytying #tying_materials FLY TYING MATERIALS  Feathers, Hackles, Cock &amp; Hen Capes, Hair, Fur, Adhesives, Dyes, Varnish, Wire, Tinsel, Floss, Tying Wax, Flash Materials. At a main stockist HERE &gt;&gt;&gt; https://t.co/0uewUObahU  https://t.co/ED6bcmyObn",en,[],['https://www.fly-fishing-tackle.co.uk/acatalog/fly_tying_materials.html'],['https://pbs.twimg.com/media/DvyHaopXcAE330u.jpg'],0,0,0,"['flytying', 'tying_materials']",[],https://twitter.com/FFTCOUK/status/1079886944178446337,False,,1,https://pbs.twimg.com/media/DvyHaopXcAE330u.jpg,,,,,,,[],,,,
1079886635217666048,1079886635217666048,2018-12-31 18:46:51 EST,2018-12-31,18:46:51,-0500,2836895065,almighty_bini,bini 🍓,,it's 0:46 and dad and puu are watching a yt tutorial and try to learn the floss dance 😂😂😂,en,[],[],[],0,0,1,[],[],https://twitter.com/almighty_bini/status/1079886635217666048,False,,0,,,,,,,,[],,,,
1079886616133537794,1079877933026689025,2018-12-31 18:46:47 EST,2018-12-31,18:46:47,-0500,131355191,johnsimmsasklaw,John Simms,,@JColemanKY @Coach_OBryan I thought Chris had a high jump record? You couldn’t fit dental floss under that vertical.,en,[],[],[],1,0,3,[],[],https://twitter.com/Johnsimmsasklaw/status/1079886616133537794,False,,0,,,,,,,,"[{'screen_name': 'JColemanKY', 'name': 'Jacqueline Coleman', 'id': '1387348058'}, {'screen_name': 'Coach_OBryan', 'name': ""Chris O'Bryan"", 'id': '174092209'}]",,,,
1079886162553171975,1079884442401947649,2018-12-31 18:44:59 EST,2018-12-31,18:44:59,-0500,1163624443,bakurashole,xiao owner,,@baekchensbabe im gonna use his hairs as tooth floss,en,[],[],[],0,0,0,[],[],https://twitter.com/bakurashole/status/1079886162553171975,False,,0,,,,,,,,[],,,,
1079886003542941696,1079886003542941696,2018-12-31 18:44:21 EST,2018-12-31,18:44:21,-0500,75662574,the_real_floss,Floss Dinero,,"“That’s too famous, we don’t even really do famous, we Kool on that, chunK the 2 fingerz” #LP  #UnKleFLO  #HolidaySZN 🎄  #TwinSet 👯‍♀️  #LongAsMyNiecesLoveMe 💕  #MoreLifeMoreEverything 📶…  https://t.co/rlkNYMvHCl",en,[],['https://www.instagram.com/p/BsEhJ-MnD-B/?utm_source=ig_twitter_share&igshid=pwha7fdfmz11'],[],0,0,0,"['lp', 'unkleflo', 'holidayszn', 'twinset', 'longasmyniecesloveme', 'morelifemoreeverything']",[],https://twitter.com/THE_REAL_FloSS/status/1079886003542941696,False,,0,,,,,,,,[],,,,
1079885752853385216,1079885752853385216,2018-12-31 18:43:21 EST,2018-12-31,18:43:21,-0500,727489498129436672,crocodini,Crocodini,,"Dentist: You're bleeding because you don't floss. Me: This may be true, but let's not forget that you just filmed an entire mythbusters episode in my mouth and did so using only a combat knife and a bottle of red wine vinegar.",en,[],[],[],0,1,6,[],[],https://twitter.com/Crocodini/status/1079885752853385216,False,,0,,,,,,,,[],,,,
1079885721975042050,1079885721975042050,2018-12-31 18:43:14 EST,2018-12-31,18:43:14,-0500,46241046,kaitlinnicolini,Kaitlin Nicolini,,I still can’t figure out how to do the floss dance 🤷🏼‍♀️,en,[],[],[],0,0,0,[],[],https://twitter.com/kaitlinnicolini/status/1079885721975042050,False,,0,,,,,,,,[],,,,
1079885524838449152,1079885524838449152,2018-12-31 18:42:27 EST,2018-12-31,18:42:27,-0500,418505789,flyoutchase,Red Bull Racing F1 Fan Account,,One of the funniest jokes I ever heard was that dental floss can blindfold an Asian person,en,[],[],[],1,1,0,[],[],https://twitter.com/FlyoutChase/status/1079885524838449152,False,,0,,,,,,,,[],,,,
1079885116418215941,1079885116418215941,2018-12-31 18:40:49 EST,2018-12-31,18:40:49,-0500,197462881,carolynroliver,Carolyn Oliver,,"Friends, what is your favorite (daily) very small intention/resolution? Last year I went from being a whenever-it’s-convenient dental floss user to flossing every day, and it was good. Looking for something like that.",en,[],[],[],6,1,9,[],[],https://twitter.com/CarolynROliver/status/1079885116418215941,False,,0,,,,,,,,[],,,,
1079885077616775173,1079885077616775173,2018-12-31 18:40:40 EST,2018-12-31,18:40:40,-0500,192847259,viennainformer,Vienna Informer,,Vienna Named World’s Most Livable City for the Ninth Year in a Row – Mental Floss  https://t.co/ADuEtaadfD  https://t.co/ikiMnHJSZA,en,[],['https://viennainformer.com/17704/vienna-named-worlds-most-livable-city-for-the-ninth-year-in-a-row-mental-floss/'],['https://pbs.twimg.com/media/DvyFwUwV4AAXN2Z.jpg'],0,0,0,[],[],https://twitter.com/viennainformer/status/1079885077616775173,False,,1,https://pbs.twimg.com/media/DvyFwUwV4AAXN2Z.jpg,,,,,,,[],,,,
1079884009868591109,1079884009868591109,2018-12-31 18:36:25 EST,2018-12-31,18:36:25,-0500,119605532,vintagejunkfm,vintage.junk.flea.market,,Vintage Glass Dental Floss Dispenser  https://t.co/7ojFmqAFeP via @Etsy,no,"[{'screen_name': 'etsy', 'name': 'etsy', 'id': '11522502'}]",['https://etsy.me/2Vmef40'],[],0,0,0,[],[],https://twitter.com/vintagejunkfm/status/1079884009868591109,False,,0,,,,,,,,[],,,,
1079883985461960705,1079881641345122305,2018-12-31 18:36:20 EST,2018-12-31,18:36:20,-0500,255108874,bigca27,Andy,,"@WH1TEYBHOY It's blatant as ever this year 🙄. Watching it the now but it's pish, funniest bit was Sturgeon doin the floss...",en,[],[],[],1,0,0,[],[],https://twitter.com/BigCA27/status/1079883985461960705,False,,0,,,,,,,,"[{'screen_name': 'WH1TEYBHOY', 'name': 'Whiteybhoy', 'id': '504647132'}]",,,,
1079883838229237760,1079883838229237760,2018-12-31 18:35:44 EST,2018-12-31,18:35:44,-0500,175749977,ryano891,Ryan Olmstead,,Floss with the to 10  https://t.co/ZCWH1O7uPr,en,[],['https://youtu.be/fbVrTlSGtrI'],[],0,0,0,[],[],https://twitter.com/ryano891/status/1079883838229237760,False,,0,,,,,,,,[],,,,
1079883791911403520,1079875366183993344,2018-12-31 18:35:33 EST,2018-12-31,18:35:33,-0500,4254841093,jkparkey,Julia K,,"@bookshouse1 It’s not the longest but The Mill on the Floss by George Elliot felt like it would never end. In the worst possible way. Also, the ending is full on off the wall WTF",en,[],[],[],0,0,3,[],[],https://twitter.com/jkparkey/status/1079883791911403520,False,,0,,,,,,,,"[{'screen_name': 'bookshouse1', 'name': 'BOOKSHouse', 'id': '781222374414880768'}]",,,,
1079883280256770050,1079883280256770050,2018-12-31 18:33:31 EST,2018-12-31,18:33:31,-0500,597852530,solosrising,n ‎⎊,,me trying to convince my dentist that I did in fact floss since he last saw me  https://t.co/NVnQZ6CzgG,en,[],['https://twitter.com/greedyszn/status/1079427017328730112/video/1'],[],1,0,1,[],[],https://twitter.com/solosrising/status/1079883280256770050,False,,0,,,,,,,,[],,,,
1079883015923384327,1079883015923384327,2018-12-31 18:32:28 EST,2018-12-31,18:32:28,-0500,115588310,kdrabinski,Kate Drabinski,,"I broke my New Year's 2015 flossing resolution in August, when neither my mom nor myself remembered to pack floss on our trip to Jackpot, NV and I went 36 hours without flossing. May 2019 see me back on track. #resolutions",en,[],[],[],0,0,11,['resolutions'],[],https://twitter.com/kdrabinski/status/1079883015923384327,False,,0,,,,,,,,[],,,,
1079882256045481985,1079327738492870656,2018-12-31 18:29:27 EST,2018-12-31,18:29:27,-0500,1020902427967541248,itsyabaika,Spoiler???,,@The_flossil @DoubleAgtSmith @ConnorJaundrell @Stallion_TTV @drei2123 @CewkieMonstar @miss_tna @Canfush I would! FLOSS FOR PARTNER 2019,en,[],[],[],1,0,3,[],[],https://twitter.com/ItsYabaika/status/1079882256045481985,False,,0,,,,,,,,"[{'screen_name': 'DoubleAgtSmith', 'name': 'doubleagentsmith🌸but call me das', 'id': '190894999'}, {'screen_name': 'drei2123', 'name': 'Drei2123', 'id': '1030511049592721409'}, {'screen_name': 'CewkieMonstar', 'name': 'Cewkie 🍪', 'id': '3973942157'}, {'screen_name': 'Canfush', 'name': 'Canfush🇷🇴🇵🇸', 'id': '1038785434736881664'}]",,,,
1079882078097936386,1079791976764133376,2018-12-31 18:28:45 EST,2018-12-31,18:28:45,-0500,17271287,cgeds,Claire Geddie,,@jocelyngeddie Except maybe for the floss bit x,en,[],[],[],0,0,1,[],[],https://twitter.com/cgeds/status/1079882078097936386,False,,0,,,,,,,,"[{'screen_name': 'jocelyngeddie', 'name': 'Jocelyn Geddie', 'id': '97011820'}]",,,,
1079881120144076801,1079835336321220608,2018-12-31 18:24:56 EST,2018-12-31,18:24:56,-0500,49783428,cakmakli86,Til,,@ThomasKRiley @mental_floss You have to go to the link to see the real graph.  Iceland is crazy expensive.,en,[],[],[],0,0,0,[],[],https://twitter.com/cakmakli86/status/1079881120144076801,False,,0,,,,,,,,"[{'screen_name': 'ThomasKRiley', 'name': 'Tom Riley', 'id': '293745660'}, {'screen_name': 'mental_floss', 'name': 'Mental Floss', 'id': '20065936'}]",,,,
1079880678127345666,1079880678127345666,2018-12-31 18:23:11 EST,2018-12-31,18:23:11,-0500,868531813,lawrencetheband,Lawrence,,Resolution #4: Floss.,en,[],[],[],5,2,21,[],[],https://twitter.com/lawrencetheband/status/1079880678127345666,False,,0,,,,,,,,[],,,,
1079880634145914880,1079880634145914880,2018-12-31 18:23:01 EST,2018-12-31,18:23:01,-0500,20065936,mental_floss,Mental Floss,,Our Most Popular Stories of 2018: The Only Way to Answer ‘What Is Your Greatest Weakness?’ In a Job Interview —  https://t.co/qxXoJ44bGb  https://t.co/Kr26OvPvB3,en,[],['https://bit.ly/2D9TzpE'],['https://pbs.twimg.com/media/DvyBtoMXQAAsMn3.jpg'],0,4,12,[],[],https://twitter.com/mental_floss/status/1079880634145914880,False,,1,https://pbs.twimg.com/media/DvyBtoMXQAAsMn3.jpg,,,,,,,[],,,,
1079880610796236801,1079880610796236801,2018-12-31 18:22:55 EST,2018-12-31,18:22:55,-0500,2210701411,jane_elli,Janey Elliott,,"my new years resolution is to floss every day (the dance type, not the dental hygiene type)",en,[],[],[],0,1,21,[],[],https://twitter.com/jane_elli/status/1079880610796236801,False,,0,,,,,,,,[],,,,
1079878535924367367,1079878535924367367,2018-12-31 18:14:40 EST,2018-12-31,18:14:40,-0500,214677449,ph0ebey,phoebe,,Can't believe the first thing I did in 2018 we learn how to floss,en,[],[],[],1,0,2,[],[],https://twitter.com/ph0ebey/status/1079878535924367367,False,,0,,,,,,,,[],,,,
1079878271259549697,1079835336321220608,2018-12-31 18:13:37 EST,2018-12-31,18:13:37,-0500,2239523365,juliozeta88,Julio Z,,@mental_floss In Mexico you get a tall boy,en,[],[],[],0,0,0,[],[],https://twitter.com/JulioZeta88/status/1079878271259549697,False,,0,,,,,,,,"[{'screen_name': 'mental_floss', 'name': 'Mental Floss', 'id': '20065936'}]",,,,
1079877368309862402,1079877368309862402,2018-12-31 18:10:02 EST,2018-12-31,18:10:02,-0500,144596822,icemandavid2k10,david taylor,,Can't stop laughing at nicola sturgeon doing the floss #onlyanexcuse #Hogmanay #HappyNewYear,en,[],[],[],0,0,0,"['onlyanexcuse', 'hogmanay', 'happynewyear']",[],https://twitter.com/IcemanDavid2k10/status/1079877368309862402,False,,0,,,,,,,,[],,,,
1079877248784756737,1079877245135716353,2018-12-31 18:09:33 EST,2018-12-31,18:09:33,-0500,827547652376125440,disequil,🌱 디수 DISSU,,Annnd for resolutions for 2019:  - Be more social on sns (I'm sorry I 100% suck at reply to msgs) - Draw more? (hYuNg liNe??) - Still be happy - Floss more  💪💪💪 I HOPE 2019 WILL BE A GOOD YEAR FOR ALL OF YOU GUYS! :') &amp; THANK YOU FOR MAKING 2018 A GREAT YEAR! 🎉🎉🎉,en,[],[],[],0,0,3,[],[],https://twitter.com/disequil/status/1079877248784756737,False,,0,,,,,,,,[],,,,
1079877048817078272,1079875715368210433,2018-12-31 18:08:46 EST,2018-12-31,18:08:46,-0500,228831940,mozzla_,Dylan,,"@talonivee I'll dab with you, may even floss",en,[],[],[],0,0,0,[],[],https://twitter.com/Mozzla_/status/1079877048817078272,False,,0,,,,,,,,"[{'screen_name': 'talonivee', 'name': 'talon 🐔', 'id': '4267628307'}]",,,,
1079876276276613120,1079876276276613120,2018-12-31 18:05:42 EST,2018-12-31,18:05:42,-0500,200315666,bigdragonien,Fjsal Gigante,,"Please take it from me personally, you need to take good care of your teeth. Brush and floss and all of that. I was one of the worst offenders and I basically never brushed my teeth after age 12 until I was like 26. And my teeth are in amazing condition considering that, (1/3)",en,[],[],[],1,0,0,[],[],https://twitter.com/BigDragonien/status/1079876276276613120,False,,0,,,,,,,,[],,,,
1079876129438220291,1079874457970257920,2018-12-31 18:05:07 EST,2018-12-31,18:05:07,-0500,18413169,kaliflower64,GRAND CAG!!! (690/300),,@mikiritsuu ami floss,en,[],[],[],0,0,0,[],[],https://twitter.com/KaliFlower64/status/1079876129438220291,False,,0,,,,,,,,[],,,,
1079876098937290752,1079876098937290752,2018-12-31 18:04:59 EST,2018-12-31,18:04:59,-0500,3008318629,sanbrunosmile,San Bruno Smile,,"Do you experience bleeding gums when you floss? It’s common for your gums to bleed if you don’t floss often. Once you get into the habit of flossing regularly, you shouldn’t experience bleeding. If the problem persists, call us to schedule an...  https://t.co/2CRbolwaBh",en,[],['https://www.colgate.com/en-us/oral-health/basics/brushing-and-flossing/do-your-gums-bleed-when-flossing-0513'],[],0,0,1,[],[],https://twitter.com/SanBrunoSmile/status/1079876098937290752,False,,0,,,,,,,,[],,,,
1079876091370721281,1079876091370721281,2018-12-31 18:04:57 EST,2018-12-31,18:04:57,-0500,1628783712,mhorvathdds,Michael Horvath DDS,,"Do you experience bleeding gums when you floss? It’s common for your gums to bleed if you don’t floss often. Once you get into the habit of flossing regularly, you shouldn’t experience bleeding. If the problem persists, call us to schedule an...  https://t.co/UY8fmCSggF",en,[],['https://www.colgate.com/en-us/oral-health/basics/brushing-and-flossing/do-your-gums-bleed-when-flossing-0513'],[],0,0,0,[],[],https://twitter.com/mhorvathdds/status/1079876091370721281,False,,0,,,,,,,,[],,,,
1079875859694211075,1079873123078422528,2018-12-31 18:04:02 EST,2018-12-31,18:04:02,-0500,15463226,likchan,Lik Chan 😷,,@sprsk I hope you also didn’t floss,en,[],[],[],0,0,0,[],[],https://twitter.com/LikChan/status/1079875859694211075,False,,0,,,,,,,,"[{'screen_name': 'sprsk', 'name': 'Justin Epperson', 'id': '15608978'}]",,,,
1079875784469372928,1079875784469372928,2018-12-31 18:03:44 EST,2018-12-31,18:03:44,-0500,3098325456,dranthonybonura,"Anthony Bonura, DMD",,"Do you experience bleeding gums when you floss? It’s common for your gums to bleed if you don’t floss often. Once you get into the habit of flossing regularly, you shouldn’t experience bleeding. If the problem persists, call us to schedule an...  https://t.co/XqZx5EvpkT",en,[],['https://www.colgate.com/en-us/oral-health/basics/brushing-and-flossing/do-your-gums-bleed-when-flossing-0513'],[],0,0,0,[],[],https://twitter.com/DrAnthonyBonura/status/1079875784469372928,False,,0,,,,,,,,[],,,,
1079875777150283776,1079875777150283776,2018-12-31 18:03:43 EST,2018-12-31,18:03:43,-0500,634827918,peterdesciscio,Peter L. DeSciscio,,"Do you experience bleeding gums when you floss? It’s common for your gums to bleed if you don’t floss often. Once you get into the habit of flossing regularly, you shouldn’t experience bleeding. If the problem persists, call us to schedule an...  https://t.co/ikKGIL2AOq",en,[],['https://www.colgate.com/en-us/oral-health/basics/brushing-and-flossing/do-your-gums-bleed-when-flossing-0513'],[],0,0,0,[],[],https://twitter.com/PeterDeSciscio/status/1079875777150283776,False,,0,,,,,,,,[],,,,
1079875775501721600,1079875775501721600,2018-12-31 18:03:42 EST,2018-12-31,18:03:42,-0500,796484790690058240,alfredbassindmd,"Alfred Bassin, DMD",,"Do you experience bleeding gums when you floss? It’s common for your gums to bleed if you don’t floss often. Once you get into the habit of flossing regularly, you shouldn’t experience bleeding. If the problem persists, call us to schedule an...  https://t.co/mFkJyDuplN",en,[],['https://www.colgate.com/en-us/oral-health/basics/brushing-and-flossing/do-your-gums-bleed-when-flossing-0513'],[],0,0,0,[],[],https://twitter.com/AlfredBassinDMD/status/1079875775501721600,False,,0,,,,,,,,[],,,,
1079875760083664899,1079875760083664899,2018-12-31 18:03:38 EST,2018-12-31,18:03:38,-0500,770319496439476225,kravitzmiller,Kravitz & Miller,,"Do you experience bleeding gums when you floss? It’s common for your gums to bleed if you don’t floss often. Once you get into the habit of flossing regularly, you shouldn’t experience bleeding. If the problem persists, call us to schedule an...  https://t.co/7ZlxrL9fa3",en,[],['https://www.colgate.com/en-us/oral-health/basics/brushing-and-flossing/do-your-gums-bleed-when-flossing-0513'],[],0,0,0,[],[],https://twitter.com/KravitzMiller/status/1079875760083664899,False,,0,,,,,,,,[],,,,
1079875735563718656,1079875735563718656,2018-12-31 18:03:33 EST,2018-12-31,18:03:33,-0500,829785186309005316,pauldomindental,Paul Domin,,"Do you experience bleeding gums when you floss? It’s common for your gums to bleed if you don’t floss often. Once you get into the habit of flossing regularly, you shouldn’t experience bleeding. If the problem persists, call us to schedule an...  https://t.co/Q3GtUiDyWj",en,[],['https://www.colgate.com/en-us/oral-health/basics/brushing-and-flossing/do-your-gums-bleed-when-flossing-0513'],[],0,0,0,[],[],https://twitter.com/PaulDominDental/status/1079875735563718656,False,,0,,,,,,,,[],,,,
1079875687358652417,1079875687358652417,2018-12-31 18:03:21 EST,2018-12-31,18:03:21,-0500,2579065134,chapelhilldmd,Chapel Hill Dental,,"Do you experience bleeding gums when you floss? It’s common for your gums to bleed if you don’t floss often. Once you get into the habit of flossing regularly, you shouldn’t experience bleeding. If the problem persists, call us to schedule an...  https://t.co/2TWtb5mNrg",en,[],['https://www.colgate.com/en-us/oral-health/basics/brushing-and-flossing/do-your-gums-bleed-when-flossing-0513'],[],0,0,0,[],[],https://twitter.com/ChapelHillDMD/status/1079875687358652417,False,,0,,,,,,,,[],,,,
1079875685777330176,1079875685777330176,2018-12-31 18:03:21 EST,2018-12-31,18:03:21,-0500,824632859029893120,kin_wong_dmd,Center for Adult Den,,"Do you experience bleeding gums when you floss? It’s common for your gums to bleed if you don’t floss often. Once you get into the habit of flossing regularly, you shouldn’t experience bleeding. If the problem persists, call us to schedule an...  https://t.co/VMAKmX2qdd",en,[],['https://www.colgate.com/en-us/oral-health/basics/brushing-and-flossing/do-your-gums-bleed-when-flossing-0513'],[],0,0,0,[],[],https://twitter.com/Kin_Wong_DMD/status/1079875685777330176,False,,0,,,,,,,,[],,,,
1079875581192388608,1079875581192388608,2018-12-31 18:02:56 EST,2018-12-31,18:02:56,-0500,837012882776698880,jjacobsdds,Brooklyn Dentistry,,"Do you experience bleeding gums when you floss? It’s common for your gums to bleed if you don’t floss often. Once you get into the habit of flossing regularly, you shouldn’t experience bleeding. If the problem persists, call us to schedule an...  https://t.co/2X6XGyfaF8",en,[],['https://www.colgate.com/en-us/oral-health/basics/brushing-and-flossing/do-your-gums-bleed-when-flossing-0513'],[],0,0,0,[],[],https://twitter.com/JJacobsDDS/status/1079875581192388608,False,,0,,,,,,,,[],,,,
1079875577698545666,1079875577698545666,2018-12-31 18:02:55 EST,2018-12-31,18:02:55,-0500,705848576560082944,stevenbarrydmd,Dr. Steven Barry,,"Do you experience bleeding gums when you floss? It’s common for your gums to bleed if you don’t floss often. Once you get into the habit of flossing regularly, you shouldn’t experience bleeding. If the problem persists, call us to schedule an...  https://t.co/KFKH63xJzP",en,[],['https://www.colgate.com/en-us/oral-health/basics/brushing-and-flossing/do-your-gums-bleed-when-flossing-0513'],[],0,0,0,[],[],https://twitter.com/stevenbarrydmd/status/1079875577698545666,False,,0,,,,,,,,[],,,,
1079875550934642693,1079875550934642693,2018-12-31 18:02:49 EST,2018-12-31,18:02:49,-0500,705837632853389312,dracutdentists,Amerident Dental,,"Do you experience bleeding gums when you floss? It’s common for your gums to bleed if you don’t floss often. Once you get into the habit of flossing regularly, you shouldn’t experience bleeding. If the problem persists, call us to schedule an...  https://t.co/YJX1XFVLc2",en,[],['https://www.colgate.com/en-us/oral-health/basics/brushing-and-flossing/do-your-gums-bleed-when-flossing-0513'],[],0,0,0,[],[],https://twitter.com/DracutDentists/status/1079875550934642693,False,,0,,,,,,,,[],,,,
1079875520458907648,1079875520458907648,2018-12-31 18:02:41 EST,2018-12-31,18:02:41,-0500,742841242254331905,drpaullustiger,Dr. Paul Lustiger,,"Do you experience bleeding gums when you floss? It’s common for your gums to bleed if you don’t floss often. Once you get into the habit of flossing regularly, you shouldn’t experience bleeding. If the problem persists, call us to schedule an...  https://t.co/VoeeSIc52N",en,[],['https://www.colgate.com/en-us/oral-health/basics/brushing-and-flossing/do-your-gums-bleed-when-flossing-0513'],[],0,0,0,[],[],https://twitter.com/DrPaulLustiger/status/1079875520458907648,False,,0,,,,,,,,[],,,,
